{
  "skill": "writing-clearly-and-concisely",
  "judge": "router-env-my-referee-one",
  "rubric_version": 4,
  "spec_sha": "69ef37e9424c0a7ea9dd2293b559e43ec8176379",
  "scores": {
    "D1": 11,
    "D2": 12,
    "D3": 15,
    "D4": 15,
    "D5": 15,
    "D6": 11,
    "D7": 11,
    "D8": 15
  },
  "max": {
    "D1": 20,
    "D2": 15,
    "D3": 15,
    "D4": 15,
    "D5": 15,
    "D6": 15,
    "D7": 15,
    "D8": 15
  },
  "total": 105,
  "max_total": 125,
  "percent": 84.0,
  "grade": "B",
  "findings": [
    {
      "id": "D1-1",
      "dimension": "D1",
      "severity": "medium",
      "file": "skills/writing-clearly-and-concisely/SKILL.md",
      "line": 13,
      "evidence": "\"Remove unsupported abstractions and repetition\" activates familiar editing practice, and preservation instructions recur throughout the revision sequence and safeguards. The more distinctive contributions are the exceptions involving normative force, unknown actors, control-flow conditions, and unsupported specificity.",
      "fix": "Consolidate ordinary preserve-meaning and remove-repetition reminders into one short checkpoint. Keep the technical semantic exceptions prominent and demonstrate the decisions with a few difficult before/after cases rather than repeating the general policy."
    },
    {
      "id": "D1-2",
      "dimension": "D1",
      "severity": "low",
      "file": "skills/writing-clearly-and-concisely/SKILL.md",
      "line": 30,
      "evidence": "\"When context is constrained, use an available subagent only if one exists\" restates harness capability discovery and dispatch rather than supplying writing expertise or correcting a demonstrated non-obvious dispatch mistake.",
      "fix": "Remove the generic delegation instruction. Retain only the writing-specific fallback: preserve a compact invariant list and consult the relevant reference section."
    },
    {
      "id": "D2-1",
      "dimension": "D2",
      "severity": "medium",
      "file": "skills/writing-clearly-and-concisely/SKILL.md",
      "line": 12,
      "evidence": "\"Mark semantic invariants before editing\" begins a coherent copyediting procedure, but the description also promises original drafting. There is no comparable procedure for selecting a draft's audience, reader action, supported facts, or information order when no source prose exists.",
      "fix": "Add a short original-draft branch: identify the reader and intended action, establish supported facts and required terminology, organize information around that action, draft, then apply the existing semantic and concision checks."
    },
    {
      "id": "D6-1",
      "dimension": "D6",
      "severity": "medium",
      "file": "skills/writing-clearly-and-concisely/SKILL.md",
      "line": 16,
      "evidence": "\"Make the rewrite shorter than the original\" and \"a one-line check quoting the original and both word counts\" impose a rigid output ritual on varied prose tasks. Already-minimal text may have no shorter meaning-preserving rewrite, and quoting an entire long original defeats a concise response.",
      "fix": "Check meaning and length internally by default and return only the requested prose. Permit unchanged or longer wording when fidelity or clarity requires it, explain that exception briefly, and show counts or comparison excerpts only when requested or materially useful."
    },
    {
      "id": "D7-1",
      "dimension": "D7",
      "severity": "medium",
      "file": "skills/writing-clearly-and-concisely/evals/evals.json",
      "line": 26,
      "evidence": "\"Explain likely causes and how to profile it; do not copyedit my wording\" occupies one of only three output cases while being outside the skill's stated scope. The remaining cases do not test the central negation, modal-force, quotation, unknown-actor, or already-concise boundaries.",
      "fix": "Keep technical diagnosis as a trigger negative and add in-scope output cases covering must/should/may, an unless condition, embedded quotations or identifiers, an unknown actor, and already-minimal text. Assert preservation of each semantic invariant rather than requiring particular wording."
    }
  ]
}
