{
  "skill": "feedback-mastery",
  "judge": "router-env-my-referee-two",
  "rubric_version": 4,
  "spec_sha": "69ef37e9424c0a7ea9dd2293b559e43ec8176379",
  "scores": {
    "D1": 12,
    "D2": 10,
    "D3": 11,
    "D4": 15,
    "D5": 15,
    "D6": 14,
    "D7": 14,
    "D8": 13
  },
  "max": {
    "D1": 20,
    "D2": 15,
    "D3": 15,
    "D4": 15,
    "D5": 15,
    "D6": 15,
    "D7": 15,
    "D8": 15
  },
  "total": 104,
  "max_total": 125,
  "percent": 83.2,
  "grade": "B",
  "findings": [
    {
      "id": "D1-1",
      "dimension": "D1",
      "severity": "medium",
      "file": "skills/feedback-mastery/references/feedback-sbi-model.md",
      "line": 3,
      "evidence": "The Situation-Behavior-Impact (SBI) model, developed by the Center for Creative Leadership, provides a structured approach to giving clear, objective feedback that minimizes defensiveness and promotes improvement.",
      "fix": "Delete the model exposition and 'Why SBI Works' tutorial; keep only the worked examples and calibration notes the model would not produce on its own"
    },
    {
      "id": "D1-2",
      "dimension": "D1",
      "severity": "low",
      "file": "skills/feedback-mastery/references/difficult-conversation-scripts.md",
      "line": 238,
      "evidence": "## Words to Avoid",
      "fix": "Trim the phrase banks ('You always...' -> 'I've noticed a pattern...') to the few substitutions that fix non-obvious failures; the model generates the rest unprompted"
    },
    {
      "id": "D1-3",
      "dimension": "D1",
      "severity": "low",
      "file": "skills/feedback-mastery/references/expectation-alignment.md",
      "line": 127,
      "evidence": "### RACI for Common Confusion Points",
      "fix": "Cut the RACI table and vague/explicit pairs (standard PM content) down to the trade-off framing and scope-change template this skill actually routes to"
    },
    {
      "id": "D2-1",
      "dimension": "D2",
      "severity": "low",
      "file": "skills/feedback-mastery/SKILL.md",
      "line": 11,
      "evidence": "## Compact method",
      "fix": "Add the non-obvious ordering decisions (when to skip steps, which evidence to gather before drafting, when one example beats dated history) instead of the generic prepare-deliver-agree-follow-up arc"
    },
    {
      "id": "D3-1",
      "dimension": "D3",
      "severity": "low",
      "file": "skills/feedback-mastery/SKILL.md",
      "line": 26,
      "evidence": "## Evidence and power gotchas",
      "fix": "Add 1-2 environment-specific traps with consequences (e.g., HR processes that require contemporaneous documentation, channels with retention/legal discovery)"
    },
    {
      "id": "D6-1",
      "dimension": "D6",
      "severity": "low",
      "file": "skills/feedback-mastery/SKILL.md",
      "line": 16,
      "evidence": "Preserve only information appropriate to the user's role and workplace policy.",
      "fix": "Give a concrete test for 'appropriate' (role need-to-know, policy check, ask the user when in doubt) so the confidentiality rule is decidable"
    },
    {
      "id": "D7-1",
      "dimension": "D7",
      "severity": "low",
      "file": "skills/feedback-mastery/evals/evals.json",
      "line": 9,
      "evidence": "Uses Situation-Behavior-Impact or equivalent observable-fact framing",
      "fix": "Drop 'or equivalent' and require situation, behavior, and impact to be separately identifiable so the assertion is verifiable"
    },
    {
      "id": "D8-1",
      "dimension": "D8",
      "severity": "medium",
      "file": "skills/feedback-mastery/SKILL.md",
      "line": 15,
      "evidence": "agree on a specific next step and check-in",
      "fix": "State a default check-in cadence and a one-line summary template for step 4 so follow-up is actionable without guessing"
    }
  ]
}
