{
  "skill": "humanizer",
  "judge": "router-env-my-referee-two",
  "rubric_version": 4,
  "spec_sha": "69ef37e9424c0a7ea9dd2293b559e43ec8176379",
  "scores": {
    "D1": 16,
    "D2": 14,
    "D3": 14,
    "D4": 15,
    "D5": 15,
    "D6": 14,
    "D7": 15,
    "D8": 14
  },
  "max": {
    "D1": 20,
    "D2": 15,
    "D3": 15,
    "D4": 15,
    "D5": 15,
    "D6": 15,
    "D7": 15,
    "D8": 15
  },
  "total": 117,
  "max_total": 125,
  "percent": 93.6,
  "grade": "A",
  "findings": [
    {
      "id": "D1-1",
      "dimension": "D1",
      "severity": "low",
      "file": "skills/humanizer/references/pattern-catalog.md",
      "line": 7,
      "evidence": "\"### 13. Em Dash Overuse\" heads a run of widely known mechanical tells (em dashes, boldface, title case, emojis, curly quotes, filler phrases)",
      "fix": "Compress the mechanical-cue entries to a one-line checklist and keep full before/after blocks only for entries that encode judgment (sycophancy, knowledge-cutoff residue, generic positive conclusions)."
    },
    {
      "id": "D2-1",
      "dimension": "D2",
      "severity": "low",
      "file": "skills/humanizer/SKILL.md",
      "line": 11,
      "evidence": "\"Diagnose the most consequential prose issue, make targeted changes, then compare the revision with the brief and original.\"",
      "fix": "Add the priority order: evidence risks first (vague attribution, unsupported claims), then inflation, then structure, then mechanics."
    },
    {
      "id": "D3-1",
      "dimension": "D3",
      "severity": "low",
      "file": "skills/humanizer/SKILL.md",
      "line": 46,
      "evidence": "\"Never humanize code, API identifiers, schema keys, or other exact-match text; stylistic changes can break behavior.\"",
      "fix": "Name the concrete failure: exact-match consumers (grep, tests, API contracts, search) match the literal string, so even case or quote-style changes break them."
    },
    {
      "id": "D6-1",
      "dimension": "D6",
      "severity": "low",
      "file": "skills/humanizer/SKILL.md",
      "line": 11,
      "evidence": "\"requested edit depth from the request and source; ask only for missing information that changes the edit\"",
      "fix": "Add the unspecified-depth default: \"When depth is unspecified, default to the minimal consequential edit and state that scope in the change note.\""
    },
    {
      "id": "D8-1",
      "dimension": "D8",
      "severity": "low",
      "file": "skills/humanizer/references/pattern-catalog.md",
      "line": 7,
      "evidence": "\"### 13. Em Dash Overuse\" \u2014 numbering starts at 13 and patterns 7-12 exist nowhere, so catalog entries cannot be cross-referenced by number",
      "fix": "Renumber the catalog from 1, or drop the numbers, so change notes and cross-references stay unambiguous."
    }
  ]
}
