{
  "skill": "daily-meeting-update",
  "judge": "router-env-my-referee-two",
  "rubric_version": 4,
  "spec_sha": "69ef37e9424c0a7ea9dd2293b559e43ec8176379",
  "scores": {
    "D1": 15,
    "D2": 13,
    "D3": 13,
    "D4": 15,
    "D5": 15,
    "D6": 14,
    "D7": 15,
    "D8": 14
  },
  "max": {
    "D1": 20,
    "D2": 15,
    "D3": 15,
    "D4": 15,
    "D5": 15,
    "D6": 15,
    "D7": 15,
    "D8": 15
  },
  "total": 114,
  "max_total": 125,
  "percent": 91.2,
  "grade": "A",
  "findings": [
    {
      "id": "D1-1",
      "dimension": "D1",
      "severity": "low",
      "file": "skills/daily-meeting-update/SKILL.md",
      "line": 29,
      "evidence": "\"## Interview\" restates the universally known standup question list (yesterday/today/blockers/topics) as activation content, roughly a third of the body",
      "fix": "Compress the four interview questions into a single line and keep only the expert rules (grouping, outcome-vs-investigation distinction)"
    },
    {
      "id": "D2-1",
      "dimension": "D2",
      "severity": "low",
      "file": "skills/daily-meeting-update/SKILL.md",
      "line": 38,
      "evidence": "\"Group duplicate activity appearing in session history, commits, PRs, Jira, and answers by work item\" \u2014 no procedure for reconciling contradictions between user answers and approved activity",
      "fix": "Add: if approved activity contradicts an answer (e.g. user says no blockers but commits suggest stalled work), surface the discrepancy and ask before including it"
    },
    {
      "id": "D3-1",
      "dimension": "D3",
      "severity": "low",
      "file": "skills/daily-meeting-update/SKILL.md",
      "line": 73,
      "evidence": "\"Never claim an investigation as completed delivery.\" \u2014 several Never items are bare imperatives without the non-obvious why",
      "fix": "Append a one-clause reason to each item (e.g. investigations reported as done inflate status and mislead sprint tracking)"
    },
    {
      "id": "D6-1",
      "dimension": "D6",
      "severity": "low",
      "file": "skills/daily-meeting-update/SKILL.md",
      "line": 22,
      "evidence": "\"python3 scripts/claude_digest.py --format json\" \u2014 the script offers text and json output but no stated default for which the agent should run",
      "fix": "State: always run claude_digest.py with --format json and render the summary yourself"
    },
    {
      "id": "D8-1",
      "dimension": "D8",
      "severity": "medium",
      "file": "skills/daily-meeting-update/SKILL.md",
      "line": 22,
      "evidence": "digest invocation has no branch for an empty result (session_count 0, missing ~/.claude/projects, or a non-Claude harness); the script returns silently empty",
      "fix": "Add: if the digest reports zero sessions, say so once and continue with the interview"
    }
  ]
}
