{
  "skill": "qa-test-planner",
  "judge": "router-env-my-referee-one",
  "rubric_version": 4,
  "spec_sha": "69ef37e9424c0a7ea9dd2293b559e43ec8176379",
  "scores": {
    "D1": 10,
    "D2": 12,
    "D3": 15,
    "D4": 15,
    "D5": 15,
    "D6": 15,
    "D7": 12,
    "D8": 13
  },
  "max": {
    "D1": 20,
    "D2": 15,
    "D3": 15,
    "D4": 15,
    "D5": 15,
    "D6": 15,
    "D7": 15,
    "D8": 15
  },
  "total": 107,
  "max_total": 125,
  "percent": 85.6,
  "grade": "B",
  "findings": [
    {
      "id": "D1-1",
      "dimension": "D1",
      "severity": "medium",
      "file": "skills/qa-test-planner/SKILL.md",
      "line": 23,
      "evidence": "\"Partition inputs by behavior; include boundaries (minimum/maximum, just below/above, empty, malformed)\" mostly activates standard QA knowledge. The deliverable-selection and coverage sections occupy more lines than the more distinctive release-gate and generator limitations.",
      "fix": "Condense the standard input-partition and deliverable inventories. Retain the concrete safeguards, and replace generic coverage reminders with decisions for deriving observable oracles for retries, state transitions, and irreversible operations."
    },
    {
      "id": "D2-1",
      "dimension": "D2",
      "severity": "medium",
      "file": "skills/qa-test-planner/SKILL.md",
      "line": 14,
      "evidence": "\"Explicit plan request \u2192 test plan with scope, risks, environment, entry/exit criteria\" identifies output fields but does not supply a planning procedure comparable to the manual-case workflow.",
      "fix": "Add a compact plan branch: establish requirements and risk owners, select scope from changed behavior and dependencies, derive entry/exit gates from critical coverage and unresolved risk, then reconcile the plan with available environments and execution time."
    },
    {
      "id": "D7-1",
      "dimension": "D7",
      "severity": "medium",
      "file": "skills/qa-test-planner/SKILL.md",
      "line": 45,
      "evidence": "\"They prompt interactively; inspect `--help` before use (the current scripts do not provide it)\" documents an interface deficiency rather than resolving it. Both repository smoke tests supply interview answers through stdin, but the generators lack documented batch interfaces and structured CLI results.",
      "fix": "Add a documented non-interactive JSON input mode, implement --help, and emit a machine-readable result manifest separately from diagnostic output. Extend the existing smoke tests to exercise those interfaces."
    },
    {
      "id": "D8-1",
      "dimension": "D8",
      "severity": "high",
      "file": "skills/qa-test-planner/references/bug_report_templates.md",
      "line": 383,
      "evidence": "\"| **Low** | Cosmetic, rare edge case | Next release | Typo, minor alignment, rare crash |\" routes a rare crash toward low severity without examining data loss, recoverability, or affected functionality. Frequency alone cannot establish severity.",
      "fix": "Remove rare crashes from the unconditional Low examples. Classify crashes by impact and recoverability, record reproduction frequency separately, and label response-time targets as organization-specific examples rather than established policy."
    }
  ]
}
