{
  "skill": "qa-test-planner",
  "judge": "router-env-my-referee-two",
  "rubric_version": 4,
  "spec_sha": "69ef37e9424c0a7ea9dd2293b559e43ec8176379",
  "scores": {
    "D1": 15,
    "D2": 13,
    "D3": 13,
    "D4": 15,
    "D5": 15,
    "D6": 13,
    "D7": 11,
    "D8": 14
  },
  "max": {
    "D1": 20,
    "D2": 15,
    "D3": 15,
    "D4": 15,
    "D5": 15,
    "D6": 15,
    "D7": 15,
    "D8": 15
  },
  "total": 109,
  "max_total": 125,
  "percent": 87.2,
  "grade": "B",
  "findings": [
    {
      "id": "D1-1",
      "dimension": "D1",
      "severity": "low",
      "file": "skills/qa-test-planner/SKILL.md",
      "line": 23,
      "evidence": "Partition inputs by behavior; include boundaries (minimum/maximum, just below/above, empty, malformed)",
      "fix": "Boundary value analysis is textbook knowledge; compress step 2 to 'partition inputs by behavior with boundaries and failure paths' and spend the tokens on the non-obvious safeguards"
    },
    {
      "id": "D2-1",
      "dimension": "D2",
      "severity": "low",
      "file": "skills/qa-test-planner/SKILL.md",
      "line": 15,
      "evidence": "If ambiguous, default to manual cases with a smoke core; ask only when plan, suite, or bug report is clearly intended",
      "fix": "Add a default for combined requests, e.g. 'produce the plan first, then cases that trace to its risks'"
    },
    {
      "id": "D3-1",
      "dimension": "D3",
      "severity": "low",
      "file": "skills/qa-test-planner/SKILL.md",
      "line": 30,
      "evidence": "Hard-earned safeguards list (lines 30-36) omits time/timezone- and concurrency-dependent flakiness",
      "fix": "Add a NEVER item such as 'Never assume deterministic clocks or timezones; freeze time or state the timezone in test data, or runs flake across machines'"
    },
    {
      "id": "D6-1",
      "dimension": "D6",
      "severity": "low",
      "file": "skills/qa-test-planner/SKILL.md",
      "line": 16,
      "evidence": "prioritize by changed code, critical journeys, failure impact, and execution cost",
      "fix": "State a default precedence (e.g. failure impact first, then changed-code overlap) so prioritization is reproducible"
    },
    {
      "id": "D7-1",
      "dimension": "D7",
      "severity": "medium",
      "file": "skills/qa-test-planner/SKILL.md",
      "line": 45,
      "evidence": "They prompt interactively; inspect `--help` before use (the current scripts do not provide it), and do not invoke them in a non-interactive session",
      "fix": "Give the scripts a non-interactive mode (all fields as flags or a stdin template), add --help, and drop color codes from stdout so agents can run them directly"
    },
    {
      "id": "D8-1",
      "dimension": "D8",
      "severity": "low",
      "file": "skills/qa-test-planner/SKILL.md",
      "line": 26,
      "evidence": "State environment, build, viewport, theme, locale, and device-pixel ratio when they affect reproducibility or visual comparison",
      "fix": "Add 'mark unknown environment facts as Unknown; never guess them' so deliverables stay honest when the requester cannot supply the facts"
    }
  ]
}
