{
  "skill": "humanizer",
  "judge": "router-env-my-referee-one",
  "rubric_version": 4,
  "spec_sha": "69ef37e9424c0a7ea9dd2293b559e43ec8176379",
  "scores": {
    "D1": 10,
    "D2": 15,
    "D3": 15,
    "D4": 15,
    "D5": 15,
    "D6": 15,
    "D7": 15,
    "D8": 11
  },
  "max": {
    "D1": 20,
    "D2": 15,
    "D3": 15,
    "D4": 15,
    "D5": 15,
    "D6": 15,
    "D7": 15,
    "D8": 15
  },
  "total": 111,
  "max_total": 125,
  "percent": 88.8,
  "grade": "B",
  "findings": [
    {
      "id": "D1-1",
      "dimension": "D1",
      "severity": "medium",
      "file": "skills/humanizer/SKILL.md",
      "line": 35,
      "evidence": "\u201cCheck repeated rule-of-three phrasing, \u2018not just X but Y\u2019 contrasts, synonym cycling ... and repeated transition words\u201d illustrates familiar editing advice. The 28-line Core diagnostics section is predominantly activation, while the shorter evidence-protection section supplies the more consequential specialized constraints.",
      "fix": "Condense familiar clich\u00e9, filler, rhythm, and mechanics inventories. Retain the contextual exemptions, exact-match protections, author-register preservation, and distinction between intended and measured benefits, supported by a few fact-preserving examples."
    },
    {
      "id": "D8-1",
      "dimension": "D8",
      "severity": "high",
      "file": "skills/humanizer/references/pattern-catalog.md",
      "line": 159,
      "evidence": "The Generic Positive Conclusions example replaces unsupported praise with \u201cThe acquisition expands the company into a new market,\u201d although the before-text supplies neither an acquisition nor a new market. The emoji example similarly turns \u201cUsers prefer simplicity\u201d into \u201cUser research showed a preference for simplicity.\u201d Following the optional style/filler branch therefore models adding evidence, contrary to the main protocol.",
      "fix": "Rewrite the catalog's before/after pairs so every factual claim in an after-text is supported by its before-text. Delete empty conclusions rather than inventing a replacement event, and preserve stated preferences without inventing research provenance. Audit the remaining examples with the same claim-by-claim comparison."
    }
  ]
}
