{
  "skill": "difficult-workplace-conversations",
  "judge": "router-env-my-referee-one",
  "rubric_version": 4,
  "spec_sha": "69ef37e9424c0a7ea9dd2293b559e43ec8176379",
  "scores": {
    "D1": 9,
    "D2": 13,
    "D3": 15,
    "D4": 15,
    "D5": 15,
    "D6": 12,
    "D7": 14,
    "D8": 12
  },
  "max": {
    "D1": 20,
    "D2": 15,
    "D3": 15,
    "D4": 15,
    "D5": 15,
    "D6": 15,
    "D7": 15,
    "D8": 15
  },
  "total": 105,
  "max_total": 125,
  "percent": 84.0,
  "grade": "B",
  "findings": [
    {
      "id": "D1-1",
      "dimension": "D1",
      "severity": "medium",
      "file": "skills/difficult-workplace-conversations/references/emotional-regulation.md",
      "line": 210,
      "evidence": "\"Building Emotional Resilience\" expands into familiar mindfulness, exercise, sleep, self-compassion, and coaching advice, including \"7-9 hours for most adults.\" Across the routed references, generic coaching and repeated phrase menus occupy substantially more lines than workplace-specific decision rules.",
      "fix": "Remove general wellness instruction and repetitive paraphrase menus. Keep concise workplace-specific procedures for evidence quality, power, disputed facts, pauses with reconvening times, reporting boundaries, and safe escalation."
    },
    {
      "id": "D2-1",
      "dimension": "D2",
      "severity": "medium",
      "file": "skills/difficult-workplace-conversations/SKILL.md",
      "line": 17,
      "evidence": "\"Compensation, promotion, or scope negotiation: establish the user's evidence, options, and acceptable outcomes before scripting\" supplies preparation goals but little procedure for evaluating responses or choosing the next negotiation move.",
      "fix": "Add a short negotiation decision procedure: make the concrete request, distinguish evidence objections from budget/process/authority constraints, identify tradable versus fixed terms, and close with a decision owner, criteria, and dated checkpoint or explicit fallback."
    },
    {
      "id": "D6-1",
      "dimension": "D6",
      "severity": "medium",
      "file": "skills/difficult-workplace-conversations/references/conversation-framework.md",
      "line": 90,
      "evidence": "\"Allow enough time (30-60 minutes minimum)\" and \"Not on Fridays\" prescribe universal scheduling rules for a context-dependent interpersonal task.",
      "fix": "Present duration and timing as adjustable defaults based on participant availability, urgency, topic, and follow-up access. Replace the Friday prohibition with a requirement to arrange appropriate support and a concrete follow-up opportunity."
    },
    {
      "id": "D7-1",
      "dimension": "D7",
      "severity": "low",
      "file": "skills/difficult-workplace-conversations/evals/evals.json",
      "line": 5,
      "evidence": "The output cases are \"missed-deadlines-peer\", \"manager-compensation\", and \"safety-escalation\". They cover useful common and safety scenarios but do not test the advertised facilitation route's authority, neutrality, consent, or disputed-fact conditions.",
      "fix": "Add a multi-party boundary case where authority or consent is absent, and a suitable facilitated case with conflicting accounts. Assert that the first avoids a joint meeting and the second preserves disputed facts, gives each participant a voice, and records explicit agreements."
    },
    {
      "id": "D8-1",
      "dimension": "D8",
      "severity": "medium",
      "file": "skills/difficult-workplace-conversations/SKILL.md",
      "line": 40,
      "evidence": "\"For a full facilitated multi-party plan, load ... conversation-framework.md\" routes to a predominantly two-person guide, including Person A/Person B agreements and \"Both people\" success indicators. It does not supply the promised joint-facilitation procedure.",
      "fix": "Add a dedicated facilitation section or reference covering separate preparation, confidentiality limits, consent and ground rules, balanced speaking turns, reconciliation of shared versus disputed facts, stop/escalation conditions, and participant-specific commitments. Keep the two-person guide routed to direct conversations."
    }
  ]
}
