{
  "skill": "professional-communication",
  "judge": "router-env-my-referee-two",
  "rubric_version": 4,
  "spec_sha": "69ef37e9424c0a7ea9dd2293b559e43ec8176379",
  "scores": {
    "D1": 17,
    "D2": 13,
    "D3": 14,
    "D4": 15,
    "D5": 15,
    "D6": 14,
    "D7": 14,
    "D8": 14
  },
  "max": {
    "D1": 20,
    "D2": 15,
    "D3": 15,
    "D4": 15,
    "D5": 15,
    "D6": 15,
    "D7": 15,
    "D8": 15
  },
  "total": 116,
  "max_total": 125,
  "percent": 92.8,
  "grade": "A",
  "findings": [
    {
      "id": "D1-1",
      "dimension": "D1",
      "severity": "low",
      "file": "skills/professional-communication/SKILL.md",
      "line": 17,
      "evidence": "\"Default to the lightest channel the recipient reads daily; use email for external or formal records.\"",
      "fix": "Keep the default sentence and cut the channel-role restatement; retain only the non-obvious routing rules (monitored incident path, thread-versus-channel visibility) that the model would not derive."
    },
    {
      "id": "D2-1",
      "dimension": "D2",
      "severity": "low",
      "file": "skills/professional-communication/SKILL.md",
      "line": 9,
      "evidence": "\"## Route by goal\" defines five message types but gives precedence only for the request-plus-escalation mix",
      "fix": "Add one precedence rule: \"When several goals apply, structure the message by the highest-urgency goal and fold the others into its sections.\""
    },
    {
      "id": "D3-1",
      "dimension": "D3",
      "severity": "low",
      "file": "skills/professional-communication/SKILL.md",
      "line": 27,
      "evidence": "\"Do not paste credentials, customer data, or sensitive logs into broad channels. Redact and link to access-controlled evidence.\"",
      "fix": "Keep it but add the less obvious companion trap: pasted links to internal documents also leak titles and access state through link previews; share sanitized titles or access-checked references."
    },
    {
      "id": "D6-1",
      "dimension": "D6",
      "severity": "low",
      "file": "skills/professional-communication/SKILL.md",
      "line": 17,
      "evidence": "\"Default to the lightest channel the recipient reads daily\"",
      "fix": "Add the unknown-habits default: \"If the recipient's habits are unknown, ask once, or default to the channel where the originating thread lives.\""
    },
    {
      "id": "D7-1",
      "dimension": "D7",
      "severity": "low",
      "file": "skills/professional-communication/evals/evals.json",
      "line": 6,
      "evidence": "\"Email non-technical stakeholders: critical payment issue delays release one week to March 15; QA retests Thursday, update Friday.\"",
      "fix": "Expand the prompts into full first-person user messages with names, product and channel context, as the trigger queries already do; compressed instructions under-test the audience and unknown-fact handling."
    },
    {
      "id": "D8-1",
      "dimension": "D8",
      "severity": "low",
      "file": "skills/professional-communication/SKILL.md",
      "line": 32,
      "evidence": "\"## Load by deliverable\" lists four reference rows but no load order when one task matches two rows (an email that also needs jargon translation)",
      "fix": "Add \"Load every matching row: templates first, then translation and channel checks.\""
    }
  ]
}
