{
  "skill": "requirements-clarity",
  "judge": "router-env-my-referee-one",
  "rubric_version": 4,
  "spec_sha": "69ef37e9424c0a7ea9dd2293b559e43ec8176379",
  "scores": {
    "D1": 10,
    "D2": 15,
    "D3": 15,
    "D4": 15,
    "D5": 15,
    "D6": 15,
    "D7": 10,
    "D8": 13
  },
  "max": {
    "D1": 20,
    "D2": 15,
    "D3": 15,
    "D4": 15,
    "D5": 15,
    "D6": 15,
    "D7": 15,
    "D8": 15
  },
  "total": 108,
  "max_total": 125,
  "percent": 86.4,
  "grade": "B",
  "findings": [
    {
      "id": "D1-1",
      "dimension": "D1",
      "severity": "medium",
      "file": "skills/requirements-clarity/SKILL.md",
      "line": 12,
      "evidence": "'Ask what user problem or outcome justifies the request (YAGNI)' and the generic PRD inventory in Output largely activate familiar requirements practices. By H2 line weight, Workflow (10 lines) and Gotchas (7) are predominantly activation, Clarity rubric (9) supplies custom policy, and Output (3) repeats standard document contents.",
      "fix": "Compress routine requirements-gathering and PRD-inventory guidance. Retain the repository-facts/product-decisions distinction and advisory-score override; add worked decisions for conflicting requirements or stakeholder priorities instead of repeating familiar principles."
    },
    {
      "id": "D7-1",
      "dimension": "D7",
      "severity": "medium",
      "file": "skills/requirements-clarity/evals/evals.json",
      "line": 22,
      "evidence": "'Does not invent answers or generate finished PRD' typifies the positive cases: both stop at clarification, while the third case bypasses the workflow. No case verifies the skill's principal PRD artifact or explicitly approved early-draft branch.",
      "fix": "Add end-to-end cases for a clarified feature and an explicitly approved low-score draft. Assert the PRD path/version, preserved decisions, testable acceptance criteria, labelled assumptions and open questions, and actual artifact creation; include a chat-only variant."
    },
    {
      "id": "D7-2",
      "dimension": "D7",
      "severity": "medium",
      "file": "skills/requirements-clarity/evals/trigger-queries.json",
      "line": 3,
      "evidence": "'We need a dashboard; clarify before coding' is representative of the mostly terse, explicit trigger requests. The 20 queries are balanced, but provide little realistic context or buried ambiguity to challenge routing.",
      "fix": "Replace several stubs with realistic requests containing repository paths, existing behavior, stakeholder context, and incomplete product choices. Pair an ambiguous request naming a file with a fully specified change in that same file to test that paths alone do not determine routing."
    },
    {
      "id": "D8-1",
      "dimension": "D8",
      "severity": "medium",
      "file": "skills/requirements-clarity/SKILL.md",
      "line": 16,
      "evidence": "'Write the PRD' leads directly to saving the document. Although Output says to 'Preserve agreed decisions,' there is no final reconciliation or repair loop checking acceptance criteria against the decisions collected across clarification rounds.",
      "fix": "Before saving, check each acceptance criterion against a supported decision, detect contradictions between rounds, and verify that unresolved consequential choices remain visibly labelled. Revise or return to focused clarification when that check fails."
    }
  ]
}
