{
  "skill": "domain-name-brainstormer",
  "judge": "router-env-my-referee-one",
  "rubric_version": 4,
  "spec_sha": "69ef37e9424c0a7ea9dd2293b559e43ec8176379",
  "scores": {
    "D1": 10,
    "D2": 12,
    "D3": 15,
    "D4": 15,
    "D5": 15,
    "D6": 15,
    "D7": 14,
    "D8": 13
  },
  "max": {
    "D1": 20,
    "D2": 15,
    "D3": 15,
    "D4": 15,
    "D5": 15,
    "D6": 15,
    "D7": 15,
    "D8": 15
  },
  "total": 109,
  "max_total": 125,
  "percent": 87.2,
  "grade": "B",
  "findings": [
    {
      "id": "D1-1",
      "dimension": "D1",
      "severity": "medium",
      "file": "skills/domain-name-brainstormer/SKILL.md",
      "line": 13,
      "evidence": "\u201cGenerate candidates using distinct patterns: compounds ... prefix/suffix ... evocative real words, coined blends, and carefully justified abbreviations.\u201d Much of Procedure and Output activates familiar naming practices; the strongest additional knowledge is concentrated in the registration, renewal, homograph, and HSTS gotchas.",
      "fix": "Compress the common naming-pattern recipe and routine output guidance. Preserve the less-obvious multilingual, registration-status, renewal-cost, and deployment constraints."
    },
    {
      "id": "D2-1",
      "dimension": "D2",
      "severity": "medium",
      "file": "skills/domain-name-brainstormer/SKILL.md",
      "line": 15,
      "evidence": "\u201cRank, don't overclaim\u201d asks for rationale and trade-offs but gives no decision order when pronunciation, distinctiveness, TLD preference, and budget conflict.",
      "fix": "Apply hard language, confusion, and budget constraints before ranking. Then rank surviving candidates using the user's stated priorities, explicitly explaining any trade-off between memorability, descriptiveness, spelling reliability, and recurring cost."
    },
    {
      "id": "D7-1",
      "dimension": "D7",
      "severity": "low",
      "file": "skills/domain-name-brainstormer/evals/evals.json",
      "line": 19,
      "evidence": "\u201cProvides exactly or at least 12 candidate names\u201d accepts more than the 12 names requested by the prompt.",
      "fix": "Require exactly 12 distinct candidates in this test and separately verify the requested grouping and top-three explanations."
    },
    {
      "id": "D8-1",
      "dimension": "D8",
      "severity": "medium",
      "file": "skills/domain-name-brainstormer/SKILL.md",
      "line": 16,
      "evidence": "\u201cIf no live lookup is performed, label every candidate unverified.\u201d The live-lookup branch does not explicitly resolve timeouts, rate limits, unsupported TLDs, or ambiguous responses into an output status.",
      "fix": "Define failed or inconclusive lookups as unknown/unverified, never available. Explain when to retry through a registrar, and distinguish an authoritative registration result from confirmed purchase availability."
    }
  ]
}
