{
  "skill": "difficult-workplace-conversations",
  "judge": "router-env-my-referee-two",
  "rubric_version": 4,
  "spec_sha": "69ef37e9424c0a7ea9dd2293b559e43ec8176379",
  "scores": {
    "D1": 11,
    "D2": 13,
    "D3": 14,
    "D4": 14,
    "D5": 13,
    "D6": 14,
    "D7": 15,
    "D8": 13
  },
  "max": {
    "D1": 20,
    "D2": 15,
    "D3": 15,
    "D4": 15,
    "D5": 15,
    "D6": 15,
    "D7": 15,
    "D8": 15
  },
  "total": 107,
  "max_total": 125,
  "percent": 85.6,
  "grade": "B",
  "findings": [
    {
      "id": "D1-1",
      "dimension": "D1",
      "severity": "medium",
      "file": "skills/difficult-workplace-conversations/references/emotional-regulation.md",
      "line": 214,
      "evidence": "\"**Mindfulness (5-10 min/day):**\" \u2014 long stretches of the reference are generic wellness advice (mindfulness minutes, sleep hygiene, therapy recommendations) the model knows and the agent should not recite",
      "fix": "Prune the file to the regulation worksheet, trigger inventory, and workplace day-of preparation"
    },
    {
      "id": "D1-2",
      "dimension": "D1",
      "severity": "medium",
      "file": "skills/difficult-workplace-conversations/references/conversation-framework.md",
      "line": 1,
      "evidence": "\"# Difficult Conversation Framework\" \u2014 the file largely restates classic communication-training material (facts-vs-story tables, three-phase structure, listening techniques) the model already produces",
      "fix": "Cut the textbook explanation and keep the expert deltas: time/place rules, agreement and email templates, success measures"
    },
    {
      "id": "D2-1",
      "dimension": "D2",
      "severity": "low",
      "file": "skills/difficult-workplace-conversations/SKILL.md",
      "line": 24,
      "evidence": "\"Default opening for direct feedback: **situation \u2192 observable behavior \u2192 impact \u2192 open question**\" \u2014 the compensation/scope negotiation route has no compact default opening in SKILL.md",
      "fix": "Add a negotiation default: purpose + evidence + specific ask + openness to alternatives"
    },
    {
      "id": "D3-1",
      "dimension": "D3",
      "severity": "low",
      "file": "skills/difficult-workplace-conversations/SKILL.md",
      "line": 33,
      "evidence": "\"Never promise absolute confidentiality; explain that some concerns may need escalation.\" \u2014 the NEVER list omits the discoverability gotcha for written records",
      "fix": "Add: assume any written summary may be reviewed in a formal HR/legal process; keep records factual and shared only need-to-know"
    },
    {
      "id": "D4-1",
      "dimension": "D4",
      "severity": "low",
      "file": "skills/difficult-workplace-conversations/SKILL.md",
      "line": 4,
      "evidence": "\"allowed-tools: Read, Glob, Grep\" \u2014 comma-separated, but the specification defines allowed-tools as a space-separated string, so strict parsers read tool names with trailing commas",
      "fix": "Change to `allowed-tools: Read Glob Grep`"
    },
    {
      "id": "D5-1",
      "dimension": "D5",
      "severity": "low",
      "file": "skills/difficult-workplace-conversations/SKILL.md",
      "line": 13,
      "evidence": "\"[feedback-mastery](../feedback-mastery/SKILL.md)\" \u2014 the reference escapes the skill root instead of staying skill-root-relative and one level deep",
      "fix": "Reference the sibling skill by name ('route to the feedback-mastery skill') rather than a file path"
    },
    {
      "id": "D5-2",
      "dimension": "D5",
      "severity": "low",
      "file": "skills/difficult-workplace-conversations/SKILL.md",
      "line": 40,
      "evidence": "\"For a full facilitated multi-party plan, load [conversation-framework.md]\" \u2014 the trigger undersells a file that is the general three-phase guide, so it will not load for deep one-on-one prep where it applies",
      "fix": "Reword the trigger to 'for full three-phase preparation or a facilitated multi-party plan'"
    },
    {
      "id": "D6-1",
      "dimension": "D6",
      "severity": "low",
      "file": "skills/difficult-workplace-conversations/SKILL.md",
      "line": 24,
      "evidence": "\"Adapt tone to relationship and stakes; invite correction of facts.\" \u2014 no default register for power-imbalanced conversations",
      "fix": "Default to formal-neutral, short sentences with senior stakeholders unless the user signals otherwise"
    },
    {
      "id": "D8-1",
      "dimension": "D8",
      "severity": "medium",
      "file": "skills/difficult-workplace-conversations/references/emotional-regulation.md",
      "line": 228,
      "evidence": "\"**Adequate sleep:**\" \u2014 the reference is written as advice to the human reader with no instruction for how the agent should use it, inviting unsolicited lifestyle coaching",
      "fix": "Add a usage note at the top: offer at most one in-the-moment technique when the user asks; never lecture on sleep or therapy"
    }
  ]
}
