{
  "skill": "backend-to-frontend-handoff-docs",
  "judge": "router-env-my-referee-one",
  "rubric_version": 4,
  "spec_sha": "69ef37e9424c0a7ea9dd2293b559e43ec8176379",
  "scores": {
    "D1": 16,
    "D2": 15,
    "D3": 15,
    "D4": 15,
    "D5": 15,
    "D6": 15,
    "D7": 13,
    "D8": 15
  },
  "max": {
    "D1": 20,
    "D2": 15,
    "D3": 15,
    "D4": 15,
    "D5": 15,
    "D6": 15,
    "D7": 15,
    "D8": 15
  },
  "total": 119,
  "max_total": 125,
  "percent": 95.2,
  "grade": "A",
  "findings": [
    {
      "id": "D1-1",
      "dimension": "D1",
      "severity": "low",
      "file": "skills/backend-to-frontend-handoff-docs/SKILL.md",
      "line": 34,
      "evidence": "'NEVER infer retry safety', 'NEVER suggest optimistic UI', and 'NEVER equate omitted and null' repeat the immediately preceding contract-decision bullets.",
      "fix": "Consolidate each prohibition with its rationale in the corresponding bullet. Preserve the serializer tracing, uncertain-outcome handling, and pagination-consistency guidance."
    },
    {
      "id": "D7-1",
      "dimension": "D7",
      "severity": "medium",
      "file": "skills/backend-to-frontend-handoff-docs/evals/evals.json",
      "line": 1,
      "evidence": "The cases provide prompt-level contracts such as 'Make the frontend handoff from this contract' but none supplies handlers, serializers, or error mappings to exercise the source-tracing procedure.",
      "fix": "Add a small backend fixture with differing DTO and serialized field names, omitted/null behavior, and a reachable conflict or uncertain mutation outcome. Assert that the handoff follows implementation evidence rather than inferred conventions."
    }
  ]
}
